<?xml version="1.0" encoding="UTF-8"?>
<ticket
        xmlns:xsi="http://www.w3.org/2001/XMLSchema-instance"
        xmlns="http://JD02_07.aborisenok.it.by/"
        xsi:schemaLocation="http://JD02_07.aborisenok.it.by/ XSD.xsd">
    <policlinic>
        <number>12's city policlinic</number>
        <doctor>
            <post>cardiologist</post>
            <doctorName>Martin</doctorName>
            <doctorSurname>Jonson</doctorSurname>
            <category>first</category>
            <cabinet>434</cabinet>
        </doctor>
    </policlinic>
    <visitDate>
        <date>2016-12-14</date>
        <time>13:56</time>
    </visitDate>
    <patient>
        <patientName>Tom</patientName>
        <patientSurname>Hakins</patientSurname>
        <birthDay>1978-09-30</birthDay>
        <address>
            <city>Minsk</city>
            <street>Nezavisimosti</street>
            <house>132</house>
            <room>14</room>
        </address>
    </patient>
</ticket>